{
	"id": "AirQualityStatement-081-24011",
	"type": "AirQualityObserved",
	"location": {
		"type": "Point",
		"coordinates": [
			"+0071240.09",
			"+434106.71"
		]
	},
	"measurements": [
		{
			"brandName": null,
			"modelName": null,
			"manufactureName": null,
			"serialNumber": null,
			"name": null,
			"constituantName": null,
			"siteNumber": null,
			"commonDataType": "NO2",
			"trackDataType": "459",
			"constituantType": "1",
			"startTime": "2017-10-31T00:00:00",
			"storageUnit": "ï¿½g/m3",
			"dataCanal": [
				"NO2"
			],
			"duration": "00100",
			"datasetTimeInterval": null,
			"samplingDatasetTimeInterval": null,
			"measurementNumber": "1",
			"constituantMultiplier": "0",
			"numberOfData": "9",
			"controlledProperty": null,
			"value": [
				"1.800000000000000e+001"
			]
		}
	],
	"dateObserved": "2017-10-31T00:00:00"
}